platform,type,id,parent_id,url,author,title,text,like_count,reaction_count,view_count,retweet_count,reply_count,comment_count,source,timestamp,parties_mentioned,is_kongu_related,nlp_sentiment,nlp_sentiment_score,nlp_trend_score,district
instagram,post,DWgHoqPEoTM,,https://www.instagram.com/kasengottaiyantvk/p/DWgHoqPEoTM/,kasengottaiyantvk,,"""*அனைவருக்கும் வணக்கம்*   மக்கள் விரும்பும் முதல்வர், எதிர்கால தமிழகத்தை ஆளப்போகும் *புரட்சி தளபதி தலைவர் விஜய்* அவர்களின் ஆணைக்கிணங்க,   *கோபிசெட்டிபாளையம் சட்டமன்றத் தொகுதியின் நிரந்தர சட்டமன்ற உறுப்பினர் வெற்றி வேட்பாளர்* முன்னாள் அமைச்சர், தலைமை ஒருங்கிணைப்பாளர், கழக அமைப்புச் செயலாளர், *மாண்புமிகு K.A.செங்கோட்டையன்* அவர்கள், இன்று வேட்பு மனு தாக்கல் செய்தார்...."".",13000,,,,,25,scrapling_instagram_profile,2026-04-18T03:50:40.341624,,False,neutral,0.5492,3.0,
instagram,post,DV5jkFjlwqG,,https://www.instagram.com/kasengottaiyantvk/p/DV5jkFjlwqG/,kasengottaiyantvk,,"""*கோபிசெட்டிபாளையம் சட்டமன்ற தொகுதிக்குட்பட்ட,  கோபிசெட்டிபாளையம் நகர பகுதியை சேர்ந்த முக்கிய பிரமுகர்கள், அனைத்து சமூகப் பெரியோர்களை மரியாதை நிமித்தமாக நேரில் சந்தித்து வருகிறார்*,  *தமிழக வெற்றிக் கழகத்தின்* ❤️💛❤️  கழக தலைமை ஒருங்கிணைப்பாளர், அமைப்புச் செயலாளர், முன்னாள் அமைச்சர், *சாதனை செம்மல் மாண்புமிகு K.A.செங்கோட்டையன்* அவர்கள்,  உடன் கொங்கு மண்டல தேர்தல் கண்காணிப்பாளர்,முன்னாள் நாடாளுமன்ற உறுப்பினர் *திருமதி V.சத்தியபாமா EX.MP* அவர்களும்,  மற்றும் நிகழ்வில் மாவட்ட, தொகுதி, ஒன்றிய, நகர, பேரூர் மற்றும் கிளைக் கழக நிர்வாகிகள், சார்பு அமைப்பு நிர்வாகிகள், நிகழ்வின்போது உடன் இருந்தனர்❤️💛❤️💐💐💐"".",111,,,,,0,scrapling_instagram_profile,2026-04-18T03:50:44.206793,,False,neutral,0.6273,0.0,
instagram,post,DVxitmEEmlj,,https://www.instagram.com/kasengottaiyantvk/reel/DVxitmEEmlj/,kasengottaiyantvk,,"""*விடியா திமுக அரசை கண்டித்து மாபெரும் கண்டன ஆர்ப்பாட்டம்*    *சாதிவாரி கணக்கெடுப்பு, தமிழகத்தில் சட்டம் ஒழுங்கு சீர்கேட்டையும், தமிழகம் எங்கும் பரவலாகி வரும் போதைப் பொருள், அரசியல் கட்சிகளுக்கான வழிகாட்டு நெறிமுறைகள் என்ற பெயரில் அரசியல் காழ்ப்புணர்ச்சியோடு நம் வெற்றித் தலைவர் அவர்களது மக்கள் சந்திப்பு நிகழ்ச்சிகளை முடக்கும் வகையிலும் வழிகாட்டு நெறிமுறைகளைத் திரும்பப் பெற வலியுறுத்தி*  *மாண்புமிகு கழகத் தலைவர் தளபதி விஜய்* அவர்களின் ஆணைக்கிணங்க,   ஒருங்கிணைந்த ஈரோடு மாவட்ட கழகம் சார்பாக,   கழக தலைமை ஒருங்கிணைப்பாளர், கழக அமைப்புச் செயலாளர், முன்னாள் அமைச்சர் *மாண்புமிகு K.A.செங்கோட்டையன்* அவர்களின் தலைமையில், கண்டன சிறப்புரையோடு மாபெரும் கண்டன ஆர்ப்பாட்டமானது நடைபெற்றது,   மாநகர் மாவட்ட கழக செயலாளர் திரு *விஜய்பாலாஜி* அவர்கள், ஈரோடு புறநகர் கிழக்கு மாவட்ட கழக செயலாளர் *திரு விஜய் வெங்கடேஷ்* அவர்கள், ஈரோடு புறநகர் மேற்கு மாவட்ட கழக செயலாளர் *திரு பிரதீப்குமார்* அவர்கள் முன்னிலையில் மாபெரும் கண்டன ஆர்ப்பாட்டமானது நடைபெற்றது,  கழக நிர்வாகிகள் தோழர்கள், மாவட்ட ஒன்றிய நகர பேரூராட்சி மற்றும் கிளைக் கழக நிர்வாகிகள், தொண்டர்கள் பொதுமக்கள் என பெருந்திரளாக கலந்து கொண்டனர்❤️💛❤️💐💐💐"".",455,,,,,0,scrapling_instagram_profile,2026-04-18T03:50:48.371840,,False,neutral,0.5934,3.0,
instagram,post,DVxiEGBktAm,,https://www.instagram.com/kasengottaiyantvk/p/DVxiEGBktAm/,kasengottaiyantvk,,"""*விடியா திமுக அரசை கண்டித்து மாபெரும் கண்டன ஆர்ப்பாட்டம்*    *சாதிவாரி கணக்கெடுப்பு, தமிழகத்தில் சட்டம் ஒழுங்கு சீர்கேட்டையும், தமிழகம் எங்கும் பரவலாகி வரும் போதைப் பொருள், அரசியல் கட்சிகளுக்கான வழிகாட்டு நெறிமுறைகள் என்ற பெயரில் அரசியல் காழ்ப்புணர்ச்சியோடு நம் வெற்றித் தலைவர் அவர்களது மக்கள் சந்திப்பு நிகழ்ச்சிகளை முடக்கும் வகையிலும் வழிகாட்டு நெறிமுறைகளைத் திரும்பப் பெற வலியுறுத்தி*  *மாண்புமிகு கழகத் தலைவர் தளபதி விஜய்* அவர்களின் ஆணைக்கிணங்க,   ஒருங்கிணைந்த ஈரோடு மாவட்ட கழகம் சார்பாக,   கழக தலைமை ஒருங்கிணைப்பாளர், கழக அமைப்புச் செயலாளர், முன்னாள் அமைச்சர் *மாண்புமிகு K.A.செங்கோட்டையன்* அவர்களின் தலைமையில், கண்டன சிறப்புரையோடு மாபெரும் கண்டன ஆர்ப்பாட்டமானது நடைபெற்றது,   மாநகர் மாவட்ட கழக செயலாளர் திரு *விஜய்பாலாஜி* அவர்கள், ஈரோடு புறநகர் கிழக்கு மாவட்ட கழக செயலாளர் *திரு விஜய் வெங்கடேஷ்* அவர்கள், ஈரோடு புறநகர் மேற்கு மாவட்ட கழக செயலாளர் *திரு பிரதீப்குமார்* அவர்கள் முன்னிலையில் மாபெரும் கண்டன ஆர்ப்பாட்டமானது நடைபெற்றது,  கழக நிர்வாகிகள் தோழர்கள், மாவட்ட ஒன்றிய நகர பேரூராட்சி மற்றும் கிளைக் கழக நிர்வாகிகள், தொண்டர்கள் பொதுமக்கள் என பெருந்திரளாக கலந்து கொண்டனர்❤️💛❤️💐💐💐"".",71,,,,,0,scrapling_instagram_profile,2026-04-18T03:50:52.212775,,False,neutral,0.5934,3.0,
instagram,post,DUXJNzMiDPe,,https://www.instagram.com/kasengottaiyantvk/p/DUXJNzMiDPe/,kasengottaiyantvk,,"""தேமுதிக மாநில பொதுக்குழு உறுப்பினர் *வழக்கறிஞர் பிரகாசம்* அவர்களும், டி என் பாளையம் மேற்கு ஒன்றிய இலக்கிய அணி செயலாளர் *M.M.ராஜ்குமார்* அவர்களும், வழக்கறிஞர் *P.M.கிருஷ்ணசாமி* அவர்களும், அவர்களின் வழக்கறிஞர்கள், மற்றும் அதிமுக நிர்வாகிகள் அக்கட்சியிலிருந்து விலகி இன்று  *தமிழக வெற்றி கழகத்தின் (TVK)*  ❤️💛❤️  தலைமை  ஒருங்கிணைப்பாளரும், அமைப்புச் செயலாளருமான, *முன்னாள் அமைச்சர் K.A.செங்கோட்டையன்* அவர்கள் முன்னிலையில் தங்களை *தமிழக வெற்றி கழகத்தில்* இணைத்துக் கொண்டனர்💛❤️💛  நிகழ்வில் முன்னாள் பாராளுமன்ற உறுப்பினர் *V.சத்தியபாமா* EX MP., அவர்களும், கழக நிர்வாகிகள், உடன் இருந்தனர்💐💐💐 ❤️💛❤️"".",86,,,,,0,scrapling_instagram_profile,2026-04-18T03:50:56.031774,,False,neutral,0.5928,3.0,
instagram,post,DUSVM0ukr6c,,https://www.instagram.com/kasengottaiyantvk/p/DUSVM0ukr6c/,kasengottaiyantvk,,"""கடமை, கண்ணியம், கட்டுப்பாடு என்ற பேரறிஞர் அண்ணா அவர்களின் பொன்மொழிகளை நினைவுகூர்ந்து, பேரறிஞர் பெருந்தகை அண்ணா அவர்களின் நினைவு தினத்தில் அவர்களின் திருவுருவப்படத்திற்கு மாலை அணிவித்து, மலர் தூவி அஞ்சலி செலுத்தினோம். இந்த நிகழ்வில் கழக நிர்வாகிகள் கலந்து கொண்டனர்."".",63,,,,,0,scrapling_instagram_profile,2026-04-18T03:51:00.462142,,False,neutral,0.5109,0.0,
instagram,post,DUQdArRkmfE,,https://www.instagram.com/kasengottaiyantvk/p/DUQdArRkmfE/,kasengottaiyantvk,,"""*தமிழக வெற்றி கழகத்தின் வெற்றிகரமான மூன்றாம் ஆண்டு துவக்க நாளான இன்று*   கழக நிறுவனத் தலைவர், *புரட்சித் தளபதி, தலைவர் விஜய்* அவர்களுக்கு  கழக தலைமை ஒருங்கிணைப்பாளர், அமைப்புச் செயலாளர், முன்னாள் அமைச்சர், *சாதனை செம்மல் மாண்புமிகு K.A.செங்கோட்டையன்* அவர்கள் பொன்னாடை அணிவித்து தங்களது வாழ்த்துக்களை தெரிவித்துக் கொண்டார்கள் ❤️💛❤️💐💐💐"".",135,,,,,0,scrapling_instagram_profile,2026-04-18T03:51:04.453513,,False,neutral,0.4348,3.0,
instagram,post,DT-gLsYF44p,,https://www.instagram.com/kasengottaiyantvk/p/DT-gLsYF44p/,kasengottaiyantvk,,"""கோவை மாநகர் மாவட்டம், அகில இந்திய காங்கிரஸ் கோவை வடக்கு மாவட்ட பொதுச் செயலாளர் *சதீஷ்குமார்* அவர்களின் தலைமையில், சூலூர் சட்டமன்றத் தொகுதி *அக்ஷயா பிரகாஷ்* அவர்களின் ஏற்பாட்டின் பேரில், அவர்கள் தலைமையில் மாற்றுக் கட்சிகளை சேர்ந்த 200-கும் மேற்பட்டோர் அக்கட்சியிலிருந்து விலகி இன்று,  *தமிழக வெற்றி கழகத்தின் (TVK)*  ❤️💛❤️  தலைமை  ஒருங்கிணைப்பாளரும், அமைப்புச் செயலாளருமான, *முன்னாள் அமைச்சர், சாதனை செம்மல், மாண்புமிகு K.A.செங்கோட்டையன்* அவர்கள் முன்னிலையில் தங்களை *தமிழக வெற்றி கழகத்தில்* இணைத்துக் கொண்டனர்❤️💛❤️  நிகழ்வில் முன்னாள் பாராளுமன்ற உறுப்பினர் *திருமதி V.சத்தியபாமா EX.MP* அவர்களும்,   முன்னாள் மாவட்ட ஊராட்சி குழு தலைவர் *S.R.செல்வம்* அவர்களும்  உடன் மாவட்ட தொகுதி, ஒன்றிய, நகர, பேரூராட்சி நிர்வாகிகள், நிகழ்வின்போது உடன் இருந்தனர் 💐💐💐 ❤️💛❤️"".",100,,,,,0,scrapling_instagram_profile,2026-04-18T03:51:09.612127,,False,neutral,0.6405,3.0,
instagram,post,DTzAdJMkpOK,,https://www.instagram.com/kasengottaiyantvk/p/DTzAdJMkpOK/,kasengottaiyantvk,,"34 likes, 0 comments - kasengottaiyantvk on January 21, 2026",34,,,,,0,scrapling_instagram_profile,2026-04-18T03:51:13.361573,,False,neutral,0.7022,3.0,
instagram,post,DTu9uvIEmm0,,https://www.instagram.com/kasengottaiyantvk/reel/DTu9uvIEmm0/,kasengottaiyantvk,,"""சாதனச் செம்மல் K.A  செங்கோட்டையன் அவர்களின் நேர்காணல் புதிய தலைமுறையில் இன்று இரவு 10:30 மணிக்கு"".",512,,,,,3,scrapling_instagram_profile,2026-04-18T03:51:17.011134,,False,neutral,0.6486,0.0,
instagram,post,DTuTVuaEo-P,,https://www.instagram.com/kasengottaiyantvk/p/DTuTVuaEo-P/,kasengottaiyantvk,,"""புரட்சித்தலைவர், புரட்சித்தலைவி அம்மாவின் வழியில் வந்தவன் நான். சோதனை ஏற்பட்ட போது என்னை கரம் பிடித்து அரசியலில் ஒரு வரலாறு படைகின்ற அளவிற்கு இன்று என்னை உருவாக்கியிருக்கும் தமிழக வெற்றிக் கழகத் தலைவர் தளபதி அவர்கள் என்றும் என் நெஞ்சத்தில் நீங்கா இடம் பெற்றவர். அவர் 2026 இல் தமிழ்நாடு முதலமைச்சர் ஆகும் வரை நாங்கள் அனைவரும் ஒருங்கிணைந்து மக்கள் செல்வாக்கோடு அவரை ஆட்சி கட்டிலில் அமர வைப்போம். அவருடைய தியாகத்தையும், மனித நேயத்தையும் எவராலும் ஒப்பிட இயலாது. மக்கள் நெஞ்சங்களில் நிறைந்து வாழ்ந்து கொண்டிருக்கின்றார். எங்கள் வாழ்வும், தமிழகத்தின் எதிர்காலமும், அவருடைய தலைமையில் அமையப் போகின்றது. அதற்காகத்தான் நாங்கள் அனைவரும் ஒற்றுமையாக பணியாற்றி வருகிறோம். நாளிதழில் உண்மைக்கு மாறான செய்தி வெளியாகி இருப்பது வேதனை அளிக்கிறது. நடு நிலை என்று சொல்லிக்கொண்டு இதுபோன்ற தவறான செய்திகளை வெளியிடுவது பத்திரிகை தர்மத்திற்கு உகந்ததல்ல. இந்த செய்தியை நான் வன்மையாக கண்டிக்கிறேன்."".",66,,,,,0,scrapling_instagram_profile,2026-04-18T03:51:20.647371,,False,neutral,0.5065,0.0,
instagram,post,DTmVsdRkgTu,,https://www.instagram.com/kasengottaiyantvk/p/DTmVsdRkgTu/,kasengottaiyantvk,,"""தமிழக வெற்றிக் கழகத்தின் சார்பாக பேரறிஞர் பெருந்தகை அண்ணாவின் இதயக்கனி, தமிழக மக்களின் நெஞ்சில் நீங்கா இடம்பிடித்து தெய்வமாய் வாழ்ந்துகொண்டிருக்கும் மகத்தான தலைவர், சத்துணவு தந்த சரித்திர நாயகர், இதய தெய்வம், பாரத ரத்னா, டாக்டர் புரட்சித்தலைவர்  அவர்களின் பிறந்தநாளில், புரட்சித்தலைவர் அவர்களின் திருவுருவப் படத்திற்கு மாலை அணிவித்து, மலர் தூவி மரியாதை செலுத்தினோம். இந்த நிகழ்வில் கழக நிர்வாகிகள் திரளாக கலந்து கொண்டனர்."".",93,,,,,2,scrapling_instagram_profile,2026-04-18T03:51:24.502975,,False,neutral,0.4659,0.0,
instagram,post,DTjwzIgknnC,,https://www.instagram.com/kasengottaiyantvk/p/DTjwzIgknnC/,kasengottaiyantvk,,"""*விவசாயிகளின் துணையாகவும், உழவின் அடையாளமாகவும் இருக்கும் மாடுகளை போற்றும் மாட்டுப்பொங்கல் திருநாளில், இயற்கையுடன் இணைந்த நமது வேளாண்மை கலாச்சாரத்தைக் காக்கும் விவசாயிகளும், அவர்களுடன் துணை நிற்கும் கால்நடைகளும் என்றும் செழிக்கவும், அனைவருக்கும் மாட்டுப் பொங்கல் திருநாள் நல்வாழ்த்துக்கள் தெரிவித்துக்கொண்டு கோபிசெட்டிபாளையம் நகரப் பகுதியில் நடைபெற்ற பொங்கல் திருவிழா நிகழ்ச்சிகளில்* இன்று  *தமிழக வெற்றி கழகத்தின் (TVK)*❤️💛❤️  தலைமை ஒருங்கிணைப்பாளரும், அமைப்புச் செயலாளரும், முன்னாள் அமைச்சரும், *சாதனை செம்மல் மாண்புமிகு K.A.செங்கோட்டையன்* அவர்கள் பங்கேற்று சிறப்பித்தார்கள், விழாவில் பங்கேற்ற அனைவருக்கும் பொங்கல் திருநாள் நல்வாழ்த்துக்கள் தெரிவித்துக் கொண்டார்கள் ❤️💛❤️💐💐💐"".",54,,,,,0,scrapling_instagram_profile,2026-04-18T03:51:28.118884,,False,neutral,0.4929,3.0,
instagram,post,DTiUxieEupe,,https://www.instagram.com/kasengottaiyantvk/p/DTiUxieEupe/,kasengottaiyantvk,,"""*உலகெங்கும் வாழும் தமிழர்கள் மகிழ்ச்சியுடன் கொண்டாடும் இனிய பொங்கல் திருநாள் மற்றும் மாட்டுப் பொங்கலை சீரோடும் சிறப்போடும் கொண்டாடும் விதமாக*❤️💛❤️ இன்று  *தமிழக வெற்றி கழகத்தின் (TVK)*❤️💛❤️  தலைமை ஒருங்கிணைப்பாளரும், அமைப்புச் செயலாளரும், முன்னாள் அமைச்சரும், *சாதனை செம்மல் மாண்புமிகு K.A.செங்கோட்டையன்* அவர்களின் இல்லத்தில், பொங்கல் வைத்து கால்நடைகளுக்கு உணவு வழங்கியும், *அனைவருக்கும் இனிய பொங்கல் திருநாள் நல்வாழ்த்துக்கள் தெரிவித்துக் கொண்டார்கள்* ❤️💛❤️💐💐💐"".",179,,,,,4,scrapling_instagram_profile,2026-04-18T03:51:31.733753,,False,positive,0.4991,3.0,
instagram,post,DTcRlDfl8f_,,https://www.instagram.com/kasengottaiyantvk/p/DTcRlDfl8f_/,kasengottaiyantvk,,"""ஓசூர் மாவட்டம், வேப்பனஹள்ளி சட்டமன்ற தொகுதி, *அம்மா மக்கள் முன்னேற்றக் கழகத்தை சேர்ந்த, முன்னாள் ஊராட்சி மன்ற தலைவர் S.R.சம்பங்கி* அவர்கள் தலைமையில் 100-கும் மேற்பட்டோர் அக்கட்சியிலிருந்து விலகி இன்று,  *தமிழக வெற்றி கழகத்தின் (TVK)*  ❤️💛❤️  தலைமை  ஒருங்கிணைப்பாளரும், அமைப்புச் செயலாளருமான, *முன்னாள் அமைச்சர், சாதனை செம்மல், மாண்புமிகு K.A.செங்கோட்டையன்* அவர்கள் முன்னிலையில் தங்களை *தமிழக வெற்றி கழகத்தில்* இணைத்துக் கொண்டனர்❤️💛❤️  நிகழ்வில் முன்னாள் பாராளுமன்ற உறுப்பினர் *திருமதி V.சத்தியபாமா EX.MP* அவர்களும்,  உடன் மாவட்ட செயலாளர் பிரதீப்குமார் அவர்களும், தொகுதி, ஒன்றிய, நகர, பேரூராட்சி நிர்வாகிகள், நிகழ்வின்போது உடன் இருந்தனர் 💐💐💐 ❤️💛❤️"".",45,,,,,0,scrapling_instagram_profile,2026-04-18T03:51:35.489218,,False,neutral,0.5666,3.0,
instagram,post,DTZorPNEpkj,,https://www.instagram.com/kasengottaiyantvk/reel/DTZorPNEpkj/,kasengottaiyantvk,,"""Former Minister K.A. Sengottaiyan | Exclusive Interview part-2"".",456,,,,,0,scrapling_instagram_profile,2026-04-18T03:51:39.062942,,False,neutral,0.6497,0.0,
